PMC,type,data,mistral7b,phi4-mini38b,exaone3524b,hermes38b,yi6b,hermes33b,deepseek-r18b,nuextract38b,qwen34b,phi3538b,yi9b,gemma34b,granite332b,llama323b,qwen38b,granite338b,gemma22b,llama38b,exaone3578b,phi4-phi4-mini-reasoning38b,F,M,P,R,C,A,N
PMC10673852,research-article,"In this research, the data have been obtained as part of the DEMMOCAD project after the acceptance of the Andalusian Biomedical Research Ethics Coordinating Committee (Comité Coordinador de Ética de la Investigación Biomédica de Andalucía). The study data are available under restricted access for patient confidentiality and privacy concerns of the Population Health Database custodians (Andalusian Public Health System, SSPA), access can be obtained upon request to the Director of Health Care and Health Outcomes of the Andalusian Public Health System (SSPA) who can provide the data for the purpose of use in the health and research environment. The researcher must provide the necessary documents accrediting that the project and/or research to be carried out complies with data protection laws and the application will be submitted to a committee of the SSPA, which will decide whether or not to grant access to the data. The request for the use of the data must be addressed to the person responsible for the data (Director General de Asistencia Sanitaria y Resultados en Salud, Servicio Andaluz de Salud, Avd. de la Constitución no. 18, 41071, Seville, Spain), who will usually respond within 2 weeks and provide the data once it has passed through the ethics committee and has been favourably evaluated. Source data are provided with this paper.",C,A,C,C,A,P,A,C,C,A,A,A,A,A,C,C,M,A,C,A,0,1,1,0,8,10,0
PMC10349091,research-article,"The RNA sequencing and microarray data generated in this study have been deposited to the NCBI’s Gene Expression Omnibus (GEO) under accession codes GSE226397 (RNA seq) and GSE226396 (Microarray), respectively. The mass spectrometry-based proteomics data have been deposited to ProteomeXchange Consortium with the identifier code PXD040450 . The mass-spectrometry-based metabolomics data have been deposited to ZENODO with the identifier code (105281/zenodo.765521). All data supporting the findings of this study are available from the corresponding authors upon request. Source data are provided with this paper.",F,F,F,F,F,F,F,F,F,M,F,F,P,F,F,F,M,F,F,F,17,2,1,0,0,0,0
PMC10471594,research-article,The authors declare that the data supporting the findings of this study are available within the paper and its supplementary information files. Source data are provided with this paper.,P,P,P,P,P,P,P,P,P,P,P,P,P,P,P,P,M,P,P,P,0,1,19,0,0,0,0
PMC10023780,research-article,"All data are available from the corresponding authors upon request. The source data underlying Figs. 1 b, 1 d, 1 g, 2 b–d, 3 a–b, 3 d–e, 4 b, c, 5 g–m, 6b and Supplementary Fig 1 b–d, 2 d, e, 3 a, 4 , 5 a, 7 , 8 , 10a are provided as a Source Data file. The crystal structure of SMP domain of human E-Syt2 has previously been deposited in the Protein Data Bank (PDB) under accession code 4P42 [10.2210/pdb4P42/pdb]. Supplementary information Source data are provided with this paper.",A,A,A,A,A,A,A,A,P,A,M,A,M,A,A,A,A,A,A,A,0,2,1,0,0,17,0
PMC10575862,research-article,"All data that support the findings of this study have been deposited in Figshare database under the project no 160822. Particularly, alignments used for the phylogenetic analysis, model selection analysis, and tree files can be found at 10.6084/m9.figshare.22182418, while phylogeographic inference tree files, geographic coordinates, and videos can be found at 10.6084/m9.figshare.23660571. Accession codes of all used sequences are provided in Supplementary Data 1 and 2 . Raw data for Supplementary Figures 5 – 7 are provided in Source Data. Source data are provided with this paper.",F,F,F,F,F,F,F,F,F,F,F,F,F,F,F,F,F,F,F,F,20,0,0,0,0,0,0
PMC10066381,research-article,"The data supporting the findings in this study are available either within the paper or its Supplementary Information, or from the corresponding author on request.",P,P,P,P,P,P,P,A,P,M,P,A,P,P,P,A,M,P,P,P,0,2,15,0,0,3,0
PMC10645887,research-article,"All data required to reproduce the findings presented here can be found in the manuscript, figures and supplementary materials. Source data are provided with this paper. The raw data and processed gene expression data for 5 RNAseq samples described in this manuscript are available under accession number GSE244839 . Source data are provided with this paper.",F,P,F,F,P,F,M,F,F,P,F,F,F,P,F,F,F,P,F,P,13,1,6,0,0,0,0
PMC10692113,research-article,"The present study carried out a re-analysis of an existing EEG dataset recorded from infants and adults 19 . All EEG data was converted to the CND data structure (Continuous-event Neural Data https://cnspworkshop.net , version 2023.0) 72 , allowing to carry out the analyses with the CNSP analysis scripts, which provided a platform for bringing together all the necessary libraries. The final data included in the manuscript figures and statistics have been deposited in the OSF repository https://osf.io/mdnwg 79 . The raw data are not downloadable as they must be considered in conjunction with the data collection videos. As the participants are infants, these video data are confidential data that we do not have ethical permission to make available. Study data were collected and managed using REDCap (Research Electronic Data Capture) electronic data capture tools hosted at Cambridge university 80 , 81 . The raw EEG data, without the video data, are available upon request (please contact the corresponding author).",P,M,M,M,M,P,M,F,F,A,F,P,P,F,M,F,M,F,M,F,7,8,4,0,0,1,0
PMC9975198,research-article,"The WES and RNA-Seq fastq files generated during this study, as well as level 3 files (expression count matrix, and the VCF files with the variant calling results for both SNV/INDELs and CN) have been deposited in the European Genome-Phenome Archive (EGA) under the accession EGAS00001006043 and EGAS00001006044 . The data are available under restricted access due to the possibility of revealing patient-sensitive information. Request for data access will be referred directly to the Data Access Committee (DAC) of the CNIO (mrobledo@cnio.es). The access will be granted for health/medical/biomedical purposes and according to good practice recommendations. The DAC will attempt to provide a response to all applications within two weeks of submission and render a final decision within no more than four weeks. Once access has been granted, data will be available for one month. The remaining data are available within the article and supplementary information. The publicly available microarray dataset used in this study is available from ArrayExpress ( E-MTAB-733 ) 20 and the TCGA WES and RNA-Seq data from GDC Data Portal, NIH ( https://portal.gdc.cancer.gov/ ), TCGA-PCPG 5 . Source data are provided with this paper.",F,M,F,C,F,P,M,F,C,R,F,F,C,F,M,C,F,C,C,P,8,3,2,1,6,0,0
PMC10624910,research-article,"The publicly available mRNA sequencing and clinicopathological data of patients with HCC used in this study are accessible in the Cancer Genome Atlas Program (TCGA) database under accession code phs000178.v11.p8 30 . The use of these publicly available data from HCC was also consulted on the website ( http://kmplot.com/analysis/index.php?p=service&cancer=liver_rnaseq ) according to the web tool’s instruction 31 , under the specific product name: KM Plotter-Liver Cancer. The proteomics data generated in the study has been deposited tin the Proteome X consortium via the PRIDE partner repository under accession code PXD037074 ( https://www.iprox.cn//page/project.html?id=IPX0005126000 ). MiRNAs potentially regulating CTSB expression were predicted using three different online search tools: TargetScan 39 ( https://www.targetscan.org/vert_80/ ), miRmap 47 ( https://mirmap.ezlab.org/ ), and RNA22 48 ( https://cm.jefferson.edu/rna22/ ), following the instructions provided by the developers of these web tools.The remaining data are available within the Article, Supplementary Information or Source Data file. Source data are provided with this manuscript. Source data are provided with this paper.",F,F,F,F,F,F,F,F,F,F,F,F,P,F,F,F,F,F,F,F,19,0,1,0,0,0,0
PMC9873927,research-article,"Crystallographic data for the structure reported in this Article have been deposited at the Cambridge Crystallographic Data Centre under deposition number CCDC 2166731 [(PPT’) 2 PbI 4 , https://www.ccdc.cam.ac.uk/structures/Search?access=referee&ccdc=2166731&Author=Zeller ] and 2113526 [(PPT) 2 PbI 4 , https://www.ccdc.cam.ac.uk/structures/Search?access=referee&ccdc=2113526&Author=Zeller ]. Copies of the data can be obtained free of charge via https://www.ccdc.cam.ac.uk/structures/ . All other data supporting the findings of this study are available within the Article and its Supplementary Information .",F,F,P,F,F,F,F,F,F,P,F,F,P,F,F,F,F,P,F,F,16,0,4,0,0,0,0
PMC10636130,research-article,"The datasets generated during and/or analyzed during the current study are available in the figshare repository, 10.6084/m9.figshare.24050985.",F,F,F,F,P,F,F,F,F,F,F,F,F,F,F,F,F,F,F,F,19,0,1,0,0,0,0
PMC10517152,research-article,"Source data are provided with this paper. The time-series image data for the Swiss site generated in this study have been deposited in a Dryad repository [10.5061/dryad.1g1jwsv11] 93 . The time-series image data for Japanese site generated in this study as well as the labeling data for image analysis used in this study are available in a Dryad repository [10.5061/dryad.h70rxwdnk] 94 . Note that each Dryad datasets is large, nearly 250 GB. Source data are provided with this paper.",F,F,F,F,F,F,F,F,F,F,F,F,P,F,F,F,F,F,F,F,19,0,1,0,0,0,0
PMC10698156,research-article,The RNA-seq data generated from this study have been deposited in NCBI’s Gene Expression Omnibus with the accession number GEO: GSE227071 . Source data are provided with this paper. The Human genome build hg38 (Ensembl release 92) is available at [ https://www.ensembl.org/Homo_sapiens/Info/Index ]. Source data are provided with this paper.,F,F,F,F,F,F,F,F,F,F,F,F,F,F,F,F,F,F,F,F,20,0,0,0,0,0,0
PMC10363113,research-article,The data that support the findings of this study are available from the corresponding authors upon reasonable request. Source data are provided with this paper.,A,A,A,A,A,A,A,A,P,A,P,A,A,A,A,P,A,A,A,A,0,0,3,0,0,17,0
PMC10115798,research-article,The mass spectrometry proteomics data generated in this study have been deposited in the ProteomeXchange Consortium via the PRIDE partner repository with the dataset identifier PXD039984 . The RNA-seq data are available in the Sequence Read Archive database under accession code PRJNA950890 . All other data generated or analyzed in this study are available within the article and its supplementary materials. Source data are provided with this paper.,F,F,F,F,F,F,F,F,F,F,F,F,P,F,F,F,F,F,F,F,19,0,1,0,0,0,0
PMC10477317,research-article,All data are available in the main text or the Supplementary Information. All other data are available from the corresponding author upon request.,P,A,A,P,P,A,P,A,P,P,P,A,A,P,P,A,M,P,P,P,0,1,12,0,0,7,0
PMC10227035,research-article,All data are available in the main text or the supplementary information. Data is also available from the corresponding author upon request. Source data are provided with this paper.,P,M,P,P,A,A,P,P,M,P,P,P,P,A,M,P,M,P,P,P,0,4,13,0,0,3,0
PMC10667221,research-article,Source data are provided as a Source Data file. Source data are provided in this paper.,P,N,F,P,P,P,A,P,P,P,P,P,P,P,P,P,P,P,P,F,2,0,16,0,0,1,1
PMC9842657,research-article,"Relevant data supporting the key findings of this study are available within the article, the Supplementary Information and Source Data files. All raw data generated during the current study are available from the corresponding authors upon request. Source data are provided with this paper.",P,P,P,P,P,A,A,P,P,M,P,P,P,P,A,P,M,P,P,P,0,2,15,0,0,3,0
PMC10338504,research-article,The generated simulation data is available at https://github.com/kleshnina/stochgames_info .,P,P,P,P,P,P,P,P,P,P,P,P,P,P,P,P,P,P,P,P,0,0,20,0,0,0,0
PMC10113739,research-article,"The sequence, model, and validation data generated in this study have been deposited in the DataDryad database under accession code [10.5061/dryad.51c59zwbn] 95 . The processed HMM seed data are available at PFAM on InterPro [ https://www.ebi.ac.uk/interpro/ ] 48 . The unprocessed sequence data are available at Swiss-Prot and TREMBL on Uniprot [ https://www.uniprot.org/ ] 96 . The plotting data generated in this study are provided in the Source Data file are available in the DataDryad database.",F,F,F,F,F,F,F,F,F,F,F,F,F,F,F,F,F,F,F,F,20,0,0,0,0,0,0
PMC10511454,research-article,The data generated in this study and shown in all the plots in this paper and the supplementary material have been deposited in the Cornell University e-commons data repository database under accession code 10.7298/r4jy-py94.,F,M,F,F,F,F,F,F,F,F,F,F,F,F,F,F,F,F,F,P,18,1,1,0,0,0,0
PMC10584936,research-article,"All data are available from the authors on request. Crystallographic data for structures reported in this article have been deposited at The Cambridge Crystallographic Data Centre (CCDC), under deposition numbers 2183527 and 2184474. These data can be obtained free of charge from www.ccdc.cam.ac.uk/data_request/cif . A source file containing the coordinated of the optimized structures is present.",A,A,A,A,A,A,A,A,F,A,M,A,M,A,M,F,A,A,A,A,2,3,0,0,0,15,0
PMC10290715,research-article,"The multi-regional input-output tables and CO 2 emissions are from GTAP database, version 11 ( https://www.gtap.agecon.purdue.edu/databases ) upon licence. The data generated in this study have been deposited in figureshare (10.6084/m9.figshare.22777265). Please contact the corresponding authors for more details.",P,M,F,F,P,P,F,P,F,M,F,F,P,P,F,F,F,F,F,F,12,2,6,0,0,0,0
PMC10663446,research-article,"All relevant data supporting the key findings of this study are available within the article and its Supplementary Information files. The processed ChEMBL29 dataset and the datasets from the first benchmarking tests in the “Results” section can be accessed via Figshare (10.6084/m9.figshare.19914811). The datasets from the TDC benchmark platform are available at https://tdcommons.ai/benchmark/overview/ . The datasets from the MoleculeACE benchmark are available at https://github.com/molML/MoleculeACE . The HPK1 and FGFR1 datasets can be accessed via Figshare (10.6084/m9.figshare.24290899). The FDA dataset is available at https://go.drugbank.com/releases/5-1-10/downloads/approved-structure-links . The reference protein-ligand complex structures for HPK1 and FGFR1 used in this study are available in the Protein Data Bank under accession codes 7SIU [ https://www.rcsb.org/structure/7SIU ] and 5A4C [ https://www.rcsb.org/structure/5A4C ], respectively. Preliminary results from this study have been reported in the conference proceedings of ref. 58 . Source data are provided with this paper.",P,P,F,F,P,P,M,F,F,P,F,F,P,F,F,F,P,P,F,F,11,1,8,0,0,0,0
PMC10368727,research-article,"The experimental data generated in this study are provided in the Supplementary Information and Source Data file, and have been deposited in the Zenodo database under accession code 115507 (10.5281/zenodo.8132755) as a consolidated source file and raw images files along with BLI data. Source data are provided with this paper.",F,F,F,F,F,F,F,F,F,F,F,F,F,F,F,F,F,F,F,F,20,0,0,0,0,0,0
PMC9992513,research-article,"All data generated in this study are provided in the main text and Supplementary Information. Previously published structures from the PDB can be accessed via accession codes: 5Z10 , 7WLT , 7WLU . Source data are provided with this paper.",P,M,P,P,P,P,P,P,P,P,P,P,P,F,P,P,P,P,P,F,2,1,17,0,0,0,0
PMC10287696,research-article,"The minimum dataset necessary to interpret, verify and extend the work is provided in the supplementary information. The concentrations of ployhaleganated carbazoles for Figs. 1 – 6 are provided in supplementary information. The published data about congener concentrations and profiles in the environment used in Figs. 2 – 4 is from references summarized in supplementary Fig. 2 . Data in Figs. 5 and 6 , Supplementary Fig. 4 and Table 5 for emission assessment is collected from research results, international industry associations and official government document, which are introduced in Method and provided in references. Unpublished data is used for supplementary Fig. 3 .",P,A,P,P,P,P,P,P,P,P,P,P,P,P,P,P,M,P,P,P,0,1,18,0,0,1,0
PMC10082030,research-article,The numerical data generated by the custom codes for this study that support the findings are available from the corresponding authors on reasonable request.,A,A,A,A,A,P,A,A,A,A,A,A,A,A,A,A,A,A,A,A,0,0,1,0,0,19,0
PMC10449808,research-article,All the data supporting the results of this study are available in this paper and the Supplementary Information. Source data are provided with this paper.,P,P,P,P,P,F,P,P,P,P,P,P,P,P,P,P,M,P,P,P,1,1,18,0,0,0,0
PMC10700526,research-article,"RNA-seq, ATAC-seq and scRNA-seq data generated in this study are deposited in the Sequence Read Archive (SRA) database (NCBI) with accession number PRJNA524175 . The patient dataset of stromal gene expression ( GSE71729 ) 17 can be accessed from the GEO database of NCBI. The TCGA-PAAD dataset 48 can be accessed from the GDC data portal ( https://portal.gdc.cancer.gov/projects/TCGA-PAAD ). Source data are provided with this paper.",F,F,F,F,F,F,F,F,F,F,F,F,F,F,F,F,F,F,F,F,20,0,0,0,0,0,0
PMC9968291,research-article,Source data of all quantitative figures are provided in the Source data file. All data supporting the findings of this study are available at github.com/WittrupLab/CytosolQuant and at 10.6084/m9.figshare.c.5875859.v6. Source data are provided in this paper.,P,P,P,F,P,P,M,F,F,P,F,P,P,F,F,F,P,P,M,F,8,2,10,0,0,0,0
PMC10359302,research-article,"The authors declare that the data supporting the findings of this study are available within the paper and its Supplementary Information files. Information on metabolic models generated in this study is provided in Supplementary Data S1 and S9 . All metabolic models are available at the BioModels repository (ID MODEL2211100001 ). Information on phenotypic growth assays generated in this study is provided in Supplementary Data S2 . Information on experimental data including metabolomics, radial growth and metabolic activity generated in this study is provided in Supplementary Data S4 . Information on metagenomics of cystic fibrosis samples generated in this study is provided in Supplementary Data S6 and S7 . All shotgun metagenomics of sputum from 40 cystic fibrosis patients are available at the European Nucleotide Archive (project ID PRJEB54014 ). External microbiome datasets analyzed in this study were retrieved from the European Nucleotide Archive (project URLs: https://www.ebi.ac.uk/ena/browser/view/PRJEB38221 , https://www.ebi.ac.uk/ena/browser/view/PRJNA316588 , https://www.ebi.ac.uk/ena/browser/view/PRJEB32062 , https://www.ebi.ac.uk/ena/browser/view/PRJEB28422 , https://www.ebi.ac.uk/ena/browser/view/PRJNA376580 ). Source data are provided with this paper.",P,M,F,P,P,F,F,M,F,P,F,F,P,P,F,F,F,P,F,F,11,2,7,0,0,0,0
PMC10244347,research-article,The figure data in this study are deposited in the Cambridge open data archive under 10.17863/CAM.95259.,F,P,F,F,F,F,F,F,F,F,F,F,F,F,F,F,F,F,F,P,18,0,2,0,0,0,0
PMC10209092,research-article,"All the data that support the conclusions in this paper are available within this article and its supplementary Information file. Source data are provided with this paper as an excel file, which contains all the uncropped western blots, raw data, and quantified values for all the graphs presented in this paper.",P,P,P,P,P,P,P,P,P,P,P,P,P,P,P,P,P,P,P,P,0,0,20,0,0,0,0
PMC10665552,research-article,The scRNA-seq data and ATAC-seq data generated in this study have been deposited in the Gene Expression Omnibus (GEO) database under accession code GSE165657 and in the Genome Sequence Archive (GSA) under accession number HRA000780 . The disease risk genes used in this study are available in the SFARI database [ https://gene-archive.sfari.org/database/gene-scoring/ ] and the ClinVar database [ https://ftp.ncbi.nlm.nih.gov/pub/clinvar/vcf_GRCh38/clinvar_20201219.vcf.gz ]. Source data are provided with this paper.,F,F,F,F,F,F,F,F,F,F,F,F,F,F,F,F,F,F,F,F,20,0,0,0,0,0,0
PMC10382499,research-article,"We conducted secondary data analyses of publicly available data with data source listed below. County-level wastewater surveillance data: biobot.io/data County-level hospitalization data: COVID-19 Reported Patient Impact and Hospital Capacity by Facility | HealthData.gov County-level COVID-19 Community Vulnerability Index (CCVI) indexes: https://precisionforcovid.org/ccvi County-level vaccination coverage: https://data.cdc.gov/Vaccinations Daily county-level COVID-19 cases: https://usafacts.org/visualizations/coronavirus-covid-19-spread-map Daily temperature and precipitation in each county: Environmental Protection Agency https://www.ncdc.noaa.gov/cdo-web/datatools/lcd The data for USA map in Fig. 2a was sourced from R package ‘USmap’ (version 0.6.2) where relevant shape data was provided by the US Census bureau (open access): https://data.census.gov/map?layer=VT_2021_040_00_PP_D1&loc=43.3751,-113.1138,z2.6270 Secondary data (wastewater surveillance data and relevant weather, CCVI, and hospitalization data) used in the analyses could be shared by contacting the corresponding author.",P,M,F,P,M,F,M,M,F,M,R,P,P,F,R,F,M,P,R,F,6,6,5,3,0,0,0
PMC10495427,research-article,The source data generated in this study are provided in the Source Data file. Source data are provided with this paper.,P,P,F,P,P,P,P,P,P,P,P,P,P,F,P,P,P,P,P,P,2,0,18,0,0,0,0
PMC10442425,research-article,"The RNA sequencing data generated in this study have been deposited in the GEO (Gene Expression Omnibus) database under accession code GSE214150 . Clean reads were mapped to the reference genome (genome version # GCF_000001405.39_GRCh38 ;). The mass spectrometry proteomics data generated in this study have been deposited in the ProteomeXchange Consortium ( http://proteomecentral.proteomexchange.org ) via the iProX partner repository under accession code PXD037073 . The data of the membrane proteins were searched against the UniprotKB Human Reference Proteome database ( http://www.uniprot.org/ , up to date as of December 10, 2021). All other data are included in the article and Supplemental materials. Source data are provided with this paper.",F,F,F,F,F,F,F,F,F,F,F,F,F,F,F,F,F,F,F,F,20,0,0,0,0,0,0
PMC10504300,research-article,"All sequencing data generated in this study have been deposited in the Gene Expression Omnibus repository under the accession code GSE219281 . Curated snRNA-seq cell-by-gene tables are provided in the following Zenodo repository: 123 10.5281/zenodo.8190317. Metadata for each nucleus in snRNA-seq and snATAC-seq are provided in Supplementary Dataset 2 and Supplementary Dataset 6 . An IGV browser session showing ChIP-Seq, snRNA-seq, and snATAC-seq tracks, and a UCSC single cell browser session showing the snRNA-seq data, are available at https://brainome.ucsd.edu/C9_ALS_FTD/ . Source data are provided with this paper.",F,F,F,F,F,F,F,F,F,F,F,F,F,F,F,F,F,F,F,F,20,0,0,0,0,0,0
PMC10104861,research-article,"The RNA-sequencing data generated in this study have been deposited in the ArrayExpress database and are available at https://www.ebi.ac.uk/arrayexpress/experiments/E-MTAB-11750 . Untargeted metabolomics analysis is available in Supplemental Data 1 . All data are available in the article, Supplementary Information and source data. Source data are provided with this paper.",F,F,F,F,F,F,M,F,F,F,F,F,P,F,F,F,F,F,F,F,18,1,1,0,0,0,0
PMC10497540,research-article,All the source data to generate the figures are provided with this paper. Source data are provided with this paper.,P,P,P,P,P,F,A,F,P,P,P,P,P,M,P,P,P,P,P,P,2,1,16,0,0,1,0
PMC10632385,research-article,The authors declare that all data supporting the findings of this study are available within the paper and its Supplementary Information files.,P,P,P,P,P,P,P,P,P,P,P,P,P,P,P,P,M,P,P,P,0,1,19,0,0,0,0
PMC9911786,research-article,"The data that support the findings of this study are available within the paper, the Supplementary Information file, and the Source Data file. Source data are provided with this paper.",P,P,P,P,P,P,P,P,P,P,P,P,P,P,P,P,M,P,P,P,0,1,19,0,0,0,0
PMC10716179,research-article,"The authors declare that all data supporting the findings of this study is available within the paper and in the Source Data which is archived in a Zenodo digital repository: 10.5281/zenodo.7582197. The data includes the QGIS visualisation, predicted coastal classes at global transects, the manually drawn Flemming (2002) polygons, the transect classification training dataset and the pixel land-type classification training dataset for Sentinel 2.",F,F,F,F,P,F,F,F,F,F,F,F,F,F,F,F,F,F,F,F,19,0,1,0,0,0,0
