PMC,type,data,mistral7b,phi4-mini38b,exaone3524b,hermes38b,yi6b,hermes33b,deepseek-r18b,nuextract38b,qwen34b,phi3538b,yi9b,gemma34b,granite332b,llama323b,qwen38b,granite338b,gemma22b,llama38b,exaone3578b,phi4-phi4-mini-reasoning38b,F,M,P,R,C,A,N
PMC10344925,research-article,Source data are available from 10.5281/zenodo.8080248. Source data are provided with this paper.,F,F,F,F,F,F,F,F,F,F,F,F,F,F,F,F,F,F,F,F,20,0,0,0,0,0,0
PMC10575948,research-article,The data for all figures and tables are provided in the Source Data file. Raw data are provided in the Github repository 87 . Source data are provided with this paper.,P,P,P,P,P,P,P,P,P,P,F,P,P,P,P,P,P,P,P,F,2,0,18,0,0,0,0
PMC9860074,research-article,"The data supporting the findings of this work are available within the paper and the Supplementary Information files. The raw genomic reads generated in this study have been deposited in the NCBI BioSample database under the following accession codes: Plectranthus barbatus ( SAMN26547115 ), Leonotis leonurus ( SAMN26547116 ), and Prunella vulgaris ( SAMN26547117 ). The genome assemblies have been deposited in NCBI with the following accession codes: Plectranthus barbatus ( JAPKLW000000000 [ https://www.ncbi.nlm.nih.gov/nuccore/JAPKLW000000000.1/ ]), Leonotis leonurus ( JAPKLX000000000 [ https://www.ncbi.nlm.nih.gov/nuccore/JAPKLX000000000.1/ ]), and Prunella vulgaris ( JAPKLY000000000 [ https://www.ncbi.nlm.nih.gov/nuccore/JAPKLY000000000.1/ ]). The versions described in this paper are versions XXXXXX010000000. Sequences for the functionally characterized enzymes from Callicarpa americana can be found in the NCBI GenBank database: ON260868 [ https://www.ncbi.nlm.nih.gov/nuccore/ON260868.1/ ]- ON260876 [ https://www.ncbi.nlm.nih.gov/nuccore/ON260876.1/ ]. Additional data including genome assemblies and annotations, GC-MS raw data, NMR raw data, phylogenetic alignments, cluster sequences, and collinearity files can be found in our Dryad Repository [10.5061/dryad.w9ghx3frg]. 123 Source data are provided with this paper.",F,M,F,F,P,F,F,F,F,F,F,F,F,F,F,F,M,F,F,F,17,2,1,0,0,0,0
PMC10710403,research-article,The authors declare that all data supporting the findings of this study are available within the paper and its Supplementary information files.,P,P,P,P,P,P,P,P,P,P,P,P,P,P,P,P,M,P,P,P,0,1,19,0,0,0,0
PMC10349080,research-article,The authors declare that all data supporting the findings of this study are available within the article and its supplementary information files. The corresponding raw data are available on request from the corresponding author S.H.,P,P,P,P,P,A,P,P,P,P,P,A,P,P,M,P,M,P,P,P,0,2,16,0,0,2,0
PMC10140020,research-article,The data that support the findings of this study are available from the first author and corresponding authors on request. Source data are provided with this paper.,A,A,A,A,A,A,A,A,P,A,M,A,R,A,A,A,A,A,A,A,0,1,1,1,0,17,0
PMC9873912,research-article,"All data is openly accessible subject to licence conditions. Trend data was sourced from CaPTrends ( https://onlinelibrary.wiley.com/doi/full/10.1111/geb.13587 ) and the Living Planet ( https://www.livingplanetindex.org/data_portal ). Covariate data: climate ( https://chelsa-climate.org/ ), land-use ( https://luh.umd.edu/ ), governance ( https://databank.worldbank.org/source/worldwide-governance-indicators ), human development ( https://hdr.undp.org/data-center/human-development-index ), PanTHERIA traits ( https://esajournals.onlinelibrary.wiley.com/doi/10.1890/08-1494.1 ), AnAge traits ( https://genomics.senescence.info/species/index.html ), and protected areas ( https://www.protectedplanet.net/en/thematic-areas/wdpa ). All data is described in Supplementary Table 2 , with extended descriptions of how to access and use data within the code 43 . Source data are provided with this paper.",F,M,F,F,F,F,M,F,R,F,F,F,F,F,F,F,F,P,F,F,16,2,1,1,0,0,0
PMC10520053,research-article,Dataset generation details are described in “Methods” and Supplementary Note 1 . The generated files are available from the corresponding author upon request due to their large size. Preferred approach is to generate the dataset using the published source code. Detailed raw values from the figures are included in Supplementary Note 3 .,A,A,A,A,A,A,A,A,P,A,A,A,A,A,A,A,A,A,A,A,0,0,1,0,0,19,0
PMC10209077,research-article,The data used to generate the graphs shown in this study are provided in the Source Data file. The mass spectrometry and the lifespan data can be found in the supplementary data files. All other data will be made available upon request without undue reservation. Source data are provided with this paper.,P,P,A,P,M,P,P,M,P,M,P,P,A,P,M,P,M,P,P,P,0,5,13,0,0,2,0
PMC10564759,research-article,"The CRIC data are available from the CRIC Study group upon request and with a Data Use Agreement. Data requests can be made by contacting the CRIC Scientific and Data Coordinating Center at cri-projmgmt@lists.upenn.edu. Data access is controlled due to the terms of the informed consent which does not allow for the data to be posted publicly with open access. The CRIC Study group will typically respond to requests within one week, but the timeframe for providing data will vary depending on the timeline for completion of a Data Use Agreement between Penn and the receiving institution. Among other standard terms, Data Use Agreements will stipulate that the data only be used for a pre-specified purpose and that the data not be shared with third parties, and that publications of the data must appropriately recognize the source of the data. If at the time of the data request, the data are available through a federal repository, the requestor will be referred to the appropriate repository to submit a data request. ARIC data are regularly posted to repositories, including dbGaP and BioLINCC in addition, requests for data and verification analysis can be sent to the ARIC data coordinating center at University of North Carolina (aricpub@unc.edu attention David Couper) Source data are provided with this paper. Please see Supplementary Data Files and Source Data, Fig. 2 , for minimum datasets that delineate protein associations described herein. Source data are provided with this paper.",A,A,A,C,A,A,C,P,C,A,M,A,M,A,A,C,A,A,C,A,0,2,1,0,5,12,0
PMC10505166,research-article,The mass spectrometry proteomics data from RNA pull-down experiment ( Mus musculus) generated in this study have been deposited in the ProteomeXchange Consortium via the PRIDE partner repository database and are available through the accession code PXD024527 . The mass spectrometry proteomics data from human lymphoblastoid cell lines generated in this study have been deposited in the ProteomeXchange Consortium via the PRIDE partner repository database and are available through the accession code PXD042474 . Source data are provided with this paper.,F,F,F,F,F,F,F,F,F,F,F,F,F,F,F,F,F,F,F,F,20,0,0,0,0,0,0
PMC10349137,research-article,All data are available in the main text or the Supplementary Materials. The data that support the findings of this study are available from the corresponding author upon request. Source data are provided with this paper.,P,P,M,P,P,A,P,A,P,A,P,A,P,P,P,A,M,P,P,P,0,2,13,0,0,5,0
PMC10415349,research-article,"The data that support this study are available from the corresponding authors upon request. The cryo-EM reconstructions of the A61603–α 1A -AR–G q –scFv16 complex and the epinephrine–α 1A -AR–G q –scFv16 complex have been deposited in the Election Microscopy Data Bank (EMDB) under accession codes EMD-41267 (the A61603–α 1A -AR–G q –scFv16 complex) and EMD-41268 (the epinephrine–α 1A -AR–G q –scFv16 complex), respectively. The corresponding atomic models have been deposited in the Protein Data Bank (PDB) under ID codes 8THK (the A61603–α 1A -AR–G q –scFv16 complex) and 8THL (the epinephrine–α 1A -AR–G q –scFv16 complex), respectively. Publicly available PDB entries used in this study are available under the accession codes 7B6W and 6WHA . The source data underlying Fig. 5 c and 5f are provided as a Source Data file. Trajectories for molecular dynamics simulations can be found in the Figshare repository [10.6084/m9.figshare.23664450.v1] and [10.6084/m9.figshare.23664270.v1]. Source data are provided with this paper.",F,M,A,F,A,P,M,M,F,M,M,F,M,M,F,F,F,F,F,P,9,7,2,0,0,2,0
PMC10624689,research-article,Data are available upon request to the corresponding author. Data generated in this study which are not included in the manuscript are provided as Supplementary Information/Source Data files. The mass spectrometry proteomics data used in this study have been deposited to the ProteomeXchange Consortium via the PRIDE 60 partner repository with the dataset identifier PXD045052 . Source data are provided with this paper.,M,A,A,M,P,A,M,A,F,A,M,F,M,A,F,F,F,A,M,A,5,6,1,0,0,8,0
PMC10482949,research-article,The data supporting the findings of this study are available from the corresponding authors upon reasonable request. Source data for the figures and supplementary figures are provided as a Source Data file. PDB ID: 6UFM (10.2210/pdb6UFM/pdb). Source data are provided in this paper.,A,A,A,A,A,A,A,A,F,A,P,P,P,A,P,A,A,A,A,A,1,0,4,0,0,15,0
PMC10272163,research-article,"Data supporting the findings of this work are available within the paper and its Supplementary Information files . A reporting summary for this Article is available as a Supplementary Information file . The GBS data have uploaded to NCBI SRA (Sequence Read Archive) database ( SRR13518263 , SRR13493593 , SRR13493703 , and SRR13495248 ). Rice3K genomic SNPs can be downloaded from the Rice SNP-Seek Database [ https://snp-seek.irri.org/_download.zul;jsessionid=1473933665C82060834E97789296DB2A ]. The data of the 42 wild rice genomic SNPs used in the haplotype network analysis can be downloaded from NCBI [ https://www.ncbi.nlm.nih.gov/bioproject/PRJNA407820 ]. Source data are provided with this paper.",F,P,F,F,P,F,F,P,F,P,F,F,P,F,F,F,P,F,F,P,13,0,7,0,0,0,0
PMC10567721,research-article,"The whole-slide histology image data and paired pathological data from First Affiliated Hospital of Zhengzhou University, Henan Provincial People’s Hospital, and Xuanwu Hospital Capital Medical University are protected and restricted to be used with institutional permission and are therefore not publicly available due to data privacy policies. For example, whole-slide histology image data of six representative patients used for model testing was uploaded with the code and is publicly available in CodeOcean database 35 . Sanger sequencing data for IDH and TERT promoter mutations have been deposited in the Genome Sequence Archive (GSA for Human) database under ID HRA005239 . Z.-Y.Z. or W.-C.L. should be contacted to request access to the WSI data and Sanger sequencing raw data. Requests will be assessed according to institutional policies to determine whether the data request is subject to patient privacy obligations. A user agreement will be required. All other relevant data supporting the key findings of this study are available within the article and its Supplementary Information files or from the corresponding authors upon request. Source data are provided in this paper.",A,A,A,C,A,P,M,C,P,A,M,A,P,A,M,C,M,P,A,P,0,4,5,0,3,8,0
PMC10267142,research-article,The authors declare that all data supporting the findings of this study are available within the paper and the Source Data file. Source data are provided with this paper.,P,P,P,P,P,P,P,P,P,P,P,P,P,F,P,P,F,P,P,F,3,0,17,0,0,0,0
PMC10514308,research-article,"Raw and processed functional genomics data associated with this manuscript have been deposited in GEO under accession number, “ GSE200875 ”. Part of the wild-type functional genomics data is available from the previously released GEO dataset, “ GSE120157 ”. Source data for the graphs are provided with this paper. The nucleosome model figure uses the nucleosome structure from the RCSB PDB database, “ 5NL0 ”. The raw and processed data are also available through a publicly accessible Amazon Linux virtual machine image (ami-id: ami-013fa11a4a9b52628) ( https://aws.amazon.com/console/ ) and the unprocessed microscopy and western blot images are available through the stowers institute’s original data repository ( https://www.stowers.org/stowers-odr ). Source data are provided with this paper.",F,M,F,F,F,F,F,F,F,F,F,F,P,F,F,F,F,F,F,F,18,1,1,0,0,0,0
PMC10017804,research-article,Cryo-EM density map of PSII complex generated in this study has been deposited in the EM Data Bank under the accession code EMD-35045 . Source data are provided with this paper.,F,F,F,F,F,F,F,F,F,F,F,F,F,F,F,F,F,F,F,F,20,0,0,0,0,0,0
PMC10119181,research-article,The data that support the findings of this study are available within the article and its Supplementary Information files. All other relevant data supporting the findings of this study are available from the corresponding authors upon reasonable request. Source data are provided with this paper.,P,P,P,P,P,P,P,P,P,P,P,P,P,P,P,P,M,P,P,P,0,1,19,0,0,0,0
PMC10645843,research-article,The data supporting the findings of this study are available from the corresponding authors upon request. RNA-seq data generated in this study have been deposited in the Gene Expression Omnibus (GEO) database under accession code GSE241019 . Metabolomics data generated in this study have been deposited in the MassIVE database under accession code MSV000091220 . Source data are provided with this paper.,P,M,A,M,A,A,M,A,F,M,F,F,M,A,F,F,M,F,M,A,6,7,1,0,0,6,0
PMC10730562,research-article,"Deidentified patient data related to outcomes reported in this manuscript are available in the Source Data File. The RNAseq data generated in this study have been deposited in the GEO database under accession code GSE248378 The study protocol is available in the Supplementary Information file. The remaining data are available within the article, Supplementary Information or Source Data file. Source data are provided with this paper.",F,M,F,F,P,F,F,F,F,P,F,F,P,F,F,F,F,F,F,F,16,1,3,0,0,0,0
PMC10241795,research-article,"The insertions data generated in this study have been deposited in EBI. The insertions calls from 3202 samples from the 1000 Genomes Project are under project PRJEB59423 [ https://www.ebi.ac.uk/ena/browser/view/PRJEB59423 ]. The clustered calls are available under analysis ERZ16007666 [ https://www.ebi.ac.uk/ena/browser/view/ERZ16007666 ], while the single-sample calls are available under analysis ERZ16007665 [ https://www.ebi.ac.uk/ena/browser/view/ERZ16007665 ]. The insertion calls from 1047 Arabidopsis Thaliana from the 10001 Genomes Project are under project PRJEB58052 [ https://www.ebi.ac.uk/ena/browser/view/PRJEB58052 ]. The clustered calls are available under analysis ERZ14864777 [ https://www.ebi.ac.uk/ena/browser/view/ERZ14864777 ], while the single-sample calls are available under analysis ERZ16031661 [ https://www.ebi.ac.uk/ena/browser/view/ERZ16031661 ]. Sequencing data for HG002 was downloaded from NCBI (accessions SRR1766442 to SRR1766486). PacBio HiFi data for HG002 was downloaded from NCBI under accession code [ PRJNA586863 ]. The HG002 benchmark catalogue and the list of tier 1 regions were downloaded from https://ftp-trace.ncbi.nlm.nih.gov/ReferenceSamples/giab/data/AshkenazimTrio/analysis/NIST_SVs_Integration_v0.6/ . Information on accessing the 3202 CRAM files for the 1KGP project produced by NYGC can be found at https://www.internationalgenome.org/data-portal/data-collection/30x-grch38 . The Phase 2 benchmark calls produced by HGSVC are available at https://www.internationalgenome.org/data-portal/data-collection/hgsvc2 . The SV catalogue produced by NYGC was downloaded from http://ftp.1000genomes.ebi.ac.uk/vol1/ftp/data_collections/1000G_2504_high_coverage/working/20210124.SV_Illumina_Integration/1KGP_3202.gatksv_svtools_novelins.freeze_V3.wAF.vcf.gz . RepeatMasker annotations for hg19 and hg38 were downloaded from the UCSC Table Browser. Data from the 1001 Genomes Project was downloaded from NCBI under accession code [ PRJNA273563 ]. The TE library of Arabidopsis Thaliana was downloaded from https://arabidopsis.org , under Download/Genes/TAIR10 genome release/TAIR10 transposable elements. Phenotypic data was downloaded from the Arapheno database.",F,F,F,F,F,F,F,P,F,F,F,F,F,F,F,F,F,F,F,F,19,0,1,0,0,0,0
PMC10587172,research-article,"All data needed to evaluate the conclusions are present in this paper and/or the Supplementary Information. In addition, the data related to this paper are available from the EDMOND Database 50 .",P,P,P,F,P,F,P,P,P,P,P,P,P,F,P,P,F,P,P,P,4,0,16,0,0,0,0
PMC10719278,research-article,The data that supports the plots within this paper and other findings of this study are available from the corresponding authors upon request.,A,A,A,A,A,A,A,A,P,A,A,A,A,A,A,A,A,A,A,A,0,0,1,0,0,19,0
PMC10504285,research-article,The datasets generated during and/or analyzed during the current study are available from the corresponding author upon reasonable request.,A,A,A,A,A,A,A,A,A,A,A,A,A,A,A,A,A,A,A,A,0,0,0,0,0,20,0
PMC10716177,research-article,"All shareable data generated or analyzed during this case report has been made available in this manuscript and its supplementary materials . To deidentify MR images, sensitive patient data has been removed and is not publicly available to protect their privacy. The source files for the figures are available from the corresponding author upon reasonable request.",P,P,P,P,P,P,P,P,P,P,P,P,P,P,P,P,M,P,P,P,0,1,19,0,0,0,0
PMC10160084,research-article,"The authors declare that the data relating to the characterization of products, experimental protocols and the computational studies are available within the article and its Supplementary Information .",P,P,P,P,P,P,P,P,P,P,P,P,P,P,P,P,M,P,P,P,0,1,19,0,0,0,0
PMC9887073,research-article,"Gut microbiome and liver transcriptome data were deposited at China NGDC Genome Sequence Archive ( https://ngdc.cncb.ac.cn ) with access numbers CRA008527 and CRA008528 , respectively. Source data are provided with this paper.",F,F,F,F,F,F,F,F,F,F,F,F,F,F,F,F,F,F,F,F,20,0,0,0,0,0,0
PMC10667229,research-article,"The authors declare that the data supporting the findings of this study, including experimental details and compound characterization, are available within the article and its Supplementary Information file or source data file. Source data are provided with this paper. All other data are available from the corresponding author upon request.",P,M,M,P,P,A,M,A,P,M,P,P,P,P,M,P,M,P,P,P,0,6,12,0,0,2,0
PMC9984368,research-article,"The discovery proteomics data generated in this study have been deposited in the MassIVE under massive.ucsd.edu with project identifier MSV000089782 [10.25345/C5R785S9H]. Uniprot protein database ( https://www.uniprot.org ) was used for protein identification from the mass spectrometry data. Targeted proteomics data is available through the Panorama repository via https://panoramaweb.org/DILI_Biomarkers.url and at the ProteomeXchange Consortium with following identifier PXD034882 . All the clinical data used in the study are subject to a data sharing agreement with the originating institutions, available upon request to the corresponding authors, who will respond within 50 working days to provide contact details for contracting. Clinical data are available for research purposes only, for specified projects with reasonable security practices and systems in place to ensure confidentiality and data may not be shared with third parties. STARD checklist is provided in Supplementary Table 9 . Source data are provided with this paper.",F,F,F,M,F,F,M,F,F,M,F,F,P,F,F,F,F,F,F,F,16,3,1,0,0,0,0
PMC10393981,research-article,"The data that support the findings of this study are available from the corresponding author upon request. The source data used to prepare Figs. 2 , 4 and 5 as well as Supplementary Figs. 2 – 13 , 15 and 16 are provided with this paper. Source data are provided with this paper.",A,A,A,A,A,A,A,A,P,A,P,A,P,A,A,P,A,A,A,A,0,0,4,0,0,16,0
PMC9946954,research-article,"The RNA-seq data capturing the expression of controls, single and double stresses are available from https://www.ebi.ac.uk/ena as E-MTAB-11141 [ https://www.ebi.ac.uk/biostudies/arrayexpress/studies/E-MTAB-11141 ]. Source data are provided with this paper.",F,F,F,F,F,F,F,F,F,F,F,F,F,F,F,F,F,F,F,F,20,0,0,0,0,0,0
PMC10319879,research-article,"The gene expression analysis data generated by Affymetrix GeneChip Clariom S Mouse microarray have been deposited in the NCBI Gene Expression Omibus (GEO) Database under accession code GSE233935 . All other data are available within the article, Supplementary Information or Source data file or from the author upon request. Source data are provided with this paper.",F,F,F,F,F,P,M,F,F,F,F,F,P,P,M,F,M,F,F,F,14,3,3,0,0,0,0
PMC10036611,research-article,"The data supporting the findings of this study are available within the paper, Supplementary Information, and Source Data files. Further data beyond the immediate results presented here are available from the corresponding authors upon reasonable request.",P,P,P,P,P,P,P,P,P,M,P,P,M,P,P,P,M,P,M,P,0,4,16,0,0,0,0
PMC10491649,research-article,"The reagents and data generated in this study are available without restriction. RNA-sequencing data have been deposited in the Gene Expression Omnibus (GEO) repository with accession number: GSE169392 . The accession code for the mouse genome used for the RNA-seq is GRCm38, available at https://www.ncbi.nlm.nih.gov/datasets/genome/GCF_000001635.20/ . The scRNAseq database from ref. 86 can be found at http://dropviz.org/ . Source data are provided with this paper.",F,F,F,F,F,F,F,P,F,F,F,F,F,F,F,F,F,F,F,F,19,0,1,0,0,0,0
PMC10199948,research-article,The data that support the findings of this study are provided in the paper and the Supplementary Information . Source data are provided with this paper.,P,P,F,P,P,P,P,P,P,P,P,P,P,P,P,P,M,P,P,P,1,1,18,0,0,0,0
PMC10625630,research-article,All the data supporting the findings of this study are available within this paper and its Supplementary Information. Any additional information can be obtained from the corresponding author on request. Source data are provided with this paper.,P,P,P,P,P,P,P,P,P,P,P,A,P,P,P,P,M,P,P,P,0,1,18,0,0,1,0
PMC10618566,research-article,"All relevant data supporting the key findings of this study are available within the article and in Supplementary Information files. Source data are provided as a Source Data file in a ZIP folder containing the data of each graph and in Supplementary information for the uncropped Western blots. Due to size constrains, relevant raw data of FCS and single molecule localization microscopy (STORM) are provided and available at the following address 10.5281/zenodo.8366334, the remaining raw data are available upon reasonable request. Source data are provided with this paper.",P,M,P,M,P,P,M,P,F,M,F,P,P,P,M,P,M,P,M,P,2,7,11,0,0,0,0
PMC10362001,research-article,All data needed to evaluate the conclusions in the paper are present in the paper and/or the Supplementary Materials . Source data are provided with this paper. Raw OST data are available upon request. Source data are provided with this paper.,P,M,M,P,P,P,M,P,P,M,P,P,P,P,P,P,M,P,P,P,0,5,15,0,0,0,0
PMC9932169,research-article,"All scRNA sequencing data, including raw fastq sequencing files, gene expression matrices, and associated cell metadata generated in this study have been deposited in the NCBI’s Gene Expression Omnibus (GEO) database under accession number GSE198521 . Source data are provided with this paper.",F,F,F,F,F,F,F,F,F,F,F,F,F,F,F,F,F,F,F,F,20,0,0,0,0,0,0
PMC10163012,research-article,"The deep RNA-Seq datasets supporting the conclusions of this article are available in the Gene Expression Omnibus database from the National Center for Biotechnology under accession number GSE173848 . The proteomics data supporting the findings of this study are available through Mass Spectrometry Interactive Virtual Environment under accession number MSV000089617 ( MassIVE , https://massive.ucsd.edu/ProteoSAFe/static/massive.jsp?redirect=auth ). The project data are grouped and available in the BioStudies database under accession number S-BSST850 ( https://www.ebi.ac.uk/biostudies/ ). Source data are provided with this paper.",F,M,F,F,F,F,F,F,F,F,F,F,F,F,F,F,F,F,F,F,19,1,0,0,0,0,0
PMC10567733,research-article,The Mass Spectrometry data generated in this study have been deposited in the PRIDE server under accession code PXD043048 . Source data are provided with this paper.,F,F,F,F,F,F,F,F,F,F,F,F,F,F,F,F,F,F,F,F,20,0,0,0,0,0,0
PMC10656556,research-article,The genome sequencing data generated in this study have been deposited in the SRA database under accession code SRR24464804 . Source data are provided with this paper.,F,F,F,F,F,F,F,F,F,F,F,F,F,F,F,F,F,F,F,F,20,0,0,0,0,0,0
PMC10632365,research-article,The deidentified summary data generated in this study have been deposited in the Open Science Framework (OSF) database and are publicly available at https://osf.io/c58bf/ . 95 Deidentified individual level data is available upon request to the corresponding author. Source data are also included in the Source data file. Source data are provided with this paper.,P,M,F,M,F,M,M,M,F,M,F,P,M,M,M,F,F,F,M,F,8,10,2,0,0,0,0
